{"attestation_id":"attestation:sha256:45e8ea60ec3205958a7f35e702115a1953ca03ffc2548079f7ec277a5393751e","attestation_schema":"cal-pipeline-apparatus-attestation-v1-explicit-link-rc0","attestation_sha256":"sha256:45e8ea60ec3205958a7f35e702115a1953ca03ffc2548079f7ec277a5393751e","authorities":[{"id":"camerontjs-dot/claim-audit-lab semantic implementation","immutable_id":"847cc970642bb648dc994b929c2053b5c9d4648c","kind":"git-commit"},{"id":"camerontjs-dot/claim-audit-lab C2 authority","immutable_id":"8204417f478cfbd891499145a7edec5ee33405ad","kind":"git-commit"},{"id":"camerontjs-dot/apparatus-contracts C2 authority","immutable_id":"b42c827acb0a9fe65353354d709add0e27bab307","kind":"git-commit"},{"id":"camerontjs-dot/apparatus-contracts policy resolver","immutable_id":"1d33e0612befcf8016816197c90c062373796df9","kind":"git-commit"},{"id":"contract-b-v1.2.0","immutable_id":"c314e53bd91c0736aa4370a364673b069aceb43e","kind":"contract-release"}],"configuration":{"identities":[{"commitments":[{"scheme":"git-commit","value":"847cc970642bb648dc994b929c2053b5c9d4648c"}],"kind":"cal-semantic","logical_id":"cal-v1-integration-candidate-v1","resolution":{"commit_sha":"847cc970642bb648dc994b929c2053b5c9d4648c","object_path":"src/claim_audit_lab/production_v1/semantic/engine.py","repository":"camerontjs-dot/claim-audit-lab","type":"git-backed"}},{"commitments":[{"scheme":"other","value":"policy_sha256:44ecc33519fa8911079595d322f5f0decbf0389af42e153ac32214931798e42c"}],"kind":"cal-policy","logical_id":"cal-rules-v1.2.0","resolution":{"commit_sha":"8204417f478cfbd891499145a7edec5ee33405ad","object_path":"research/contract_c2_current_cal_producer_conformance_rc0/materialize.py","repository":"camerontjs-dot/claim-audit-lab","type":"git-backed"}},{"commitments":[{"scheme":"git-commit","value":"b42c827acb0a9fe65353354d709add0e27bab307"}],"kind":"c2-profile","logical_id":"contract-c-successor-candidate-a-rc2-research","resolution":{"commit_sha":"b42c827acb0a9fe65353354d709add0e27bab307","object_path":"schema/contract-c/2.0.0/reference/candidate_a_rc2.py","repository":"camerontjs-dot/apparatus-contracts","type":"git-backed"}}]},"execution":{"reason_code":"not_checkable_UNSUPPORTED_SEMANTIC_FAMILY","state":"completed"},"inputs":[{"artifact":{"artifact_id":"contract-b-snapshot","commitments":[{"scheme":"sha256-bytes","value":"sha256:2e4355a8fef9fb5d206c9d93121438be91e1ebec594fe4e06d3de6554184260e"}],"kind":"contract-b-bundle","logical_id":"contract-b.snapshot.zip"},"role":"causal_input"},{"artifact":{"artifact_id":"cal-target","commitments":[{"scheme":"sha256-bytes","value":"sha256:0e66a37066857e4ee124f96c3f52a0661d1740f68deefb276a7cdfd7c8b4aa15"}],"kind":"cal-target","logical_id":"cal-target"},"role":"authority_input"}],"operation":{"name":"run_cal_v1_bundle_plus_materialize_unsealed","version":"8204417f478cfbd891499145a7edec5ee33405ad"},"outputs":[{"artifact_id":"cal-result","commitments":[{"scheme":"sha256-bytes","value":"sha256:2dac6a75bdd617b6a7f7553271ec0aa02095d58197e3389160c9aaf62906975b"}],"kind":"cal-native-result","logical_id":"native-result"},{"artifact_id":"contract-c2","commitments":[{"scheme":"sha256-bytes","value":"sha256:af1f6512975aeda8d3f1ff816361c6481540d1383ccdc5f9e6850430d880b921"}],"kind":"contract-c2","logical_id":"contract-c2"},{"artifact_id":"c2-validation-receipt","commitments":[{"scheme":"sha256-bytes","value":"sha256:95353b5478ffcb2a714ca1911db6b97cadbb021f576fd675d40b1d8e8eb20131"}],"kind":"c2-validation-receipt","logical_id":"c2-validation-receipt"}],"producer":{"implementation":{"commit_sha":"8204417f478cfbd891499145a7edec5ee33405ad","kind":"git","repository":"camerontjs-dot/claim-audit-lab"},"system_id":"claim-audit-lab"},"run":{"run_id":"CAL-FULL-CHAIN-RC0-20260917-valve-temporal-status","work_id":"valve-temporal-status"},"stage":{"id":"claim_audit_lab","kind":"claim_audit_lab"}}
