{"attestation_id":"attestation:sha256:eca8b1b2b42292de7d44ca2c5148066671ea553233aa71af3b40e135030a1768","attestation_schema":"cal-pipeline-apparatus-attestation-v1-explicit-link-rc0","attestation_sha256":"sha256:eca8b1b2b42292de7d44ca2c5148066671ea553233aa71af3b40e135030a1768","authorities":[{"id":"contract-a-v2.0.0","immutable_id":"529c92b49a34d5c610618551a8737f019f9fa332","kind":"contract-release"},{"id":"contract-b-v1.2.0","immutable_id":"c314e53bd91c0736aa4370a364673b069aceb43e","kind":"contract-release"},{"id":"camerontjs-dot/evidence-bundler@4e1f6fe00e7c350b28f52bfea14f1f8988847884","immutable_id":"4e1f6fe00e7c350b28f52bfea14f1f8988847884","kind":"git-commit"}],"configuration":{"identities":[{"commitments":[{"scheme":"sha256-bytes","value":"sha256:5b10d0c29794e80d6876a99e26bcf6ec6a27a4c5165aee78054a6bc32759f4bc"}],"kind":"eb-profile","logical_id":"eb-v1-integration-10x3-rc0","resolution":{"commit_sha":"4e1f6fe00e7c350b28f52bfea14f1f8988847884","object_path":"research/eb_v1_integration_candidate/INTEGRATION_PROFILE.json","repository":"camerontjs-dot/evidence-bundler","type":"git-backed"}},{"commitments":[{"scheme":"git-commit","value":"4e1f6fe00e7c350b28f52bfea14f1f8988847884"}],"kind":"eb-implementation","logical_id":"evidence-bundler-v1","resolution":{"commit_sha":"4e1f6fe00e7c350b28f52bfea14f1f8988847884","object_path":"scripts/run_v1_integration_candidate.py","repository":"camerontjs-dot/evidence-bundler","type":"git-backed"}}]},"execution":{"reason_code":"completed","state":"completed"},"inputs":[{"artifact":{"artifact_id":"contract-a","commitments":[{"scheme":"sha256-bytes","value":"sha256:1706bfd9066c45e17c069cef46bf917c9afd2cd3d9d000f1318d5fde05711fe7"}],"kind":"contract-a","logical_id":"CONTRACT-A"},"role":"causal_input"},{"artifact":{"artifact_id":"compatibility-carrier","commitments":[{"scheme":"sha256-bytes","value":"sha256:7e5f88de38245c74bcda665027ba2bbbeddbe329fc6b632065dfd3cea7d8d2db"}],"kind":"compatibility-carrier","logical_id":"contract-b-compatibility-carrier"},"role":"compatibility_input"}],"operation":{"name":"run_v1_integration_candidate","version":"4e1f6fe00e7c350b28f52bfea14f1f8988847884"},"outputs":[{"artifact_id":"eb-native-package","commitments":[{"scheme":"sha256-bytes","value":"sha256:48ff003769f9f3f4068eba6a5e828e8d0c8a614fa7ec3229729c7b35e1d88db6"}],"kind":"eb-native-package","logical_id":"native_eb_v1_package"},{"artifact_id":"contract-b-snapshot","commitments":[{"scheme":"sha256-bytes","value":"sha256:b8d484357aba8208bd41fbb881f1afaf0cd59ac23b112b7a1fb783c2ca584fe0"}],"kind":"contract-b-bundle","logical_id":"contract-b"},{"artifact_id":"eb-projection-receipt","commitments":[{"scheme":"sha256-bytes","value":"sha256:777b630df8a18bef498a8ef12f4d05e780bf3544d3685f0e82c81e1dc94d6e4b"}],"kind":"eb-projection-receipt","logical_id":"projection-receipt"}],"producer":{"implementation":{"commit_sha":"4e1f6fe00e7c350b28f52bfea14f1f8988847884","kind":"git","repository":"camerontjs-dot/evidence-bundler"},"system_id":"evidence-bundler"},"run":{"run_id":"CAL-FULL-CHAIN-RC0-20260917-declared-all-of","work_id":"declared-all-of"},"stage":{"id":"evidence_bundler","kind":"evidence_bundler"}}
