{"attestation_id":"attestation:sha256:6735121aaf6e292a9253e157f7824bfad4e9376255b5c37221b7bf0261057066","attestation_schema":"cal-pipeline-apparatus-attestation-v1-explicit-link-rc0","attestation_sha256":"sha256:6735121aaf6e292a9253e157f7824bfad4e9376255b5c37221b7bf0261057066","authorities":[{"id":"camerontjs-dot/apparatus-contracts C2 authority","immutable_id":"b42c827acb0a9fe65353354d709add0e27bab307","kind":"git-commit"},{"id":"camerontjs-dot/apparatus-contracts Contract D 1.0.0","immutable_id":"298a1a0f7b7b6d7712e11200d04faec3e1ca169b","kind":"git-commit"},{"id":"camerontjs-dot/decision-engine","immutable_id":"b1bcc33e2b5ef0707b8cbf7dd8e821b2d34d1b55","kind":"git-commit"},{"id":"contract-d-v1.0.0","immutable_id":"298a1a0f7b7b6d7712e11200d04faec3e1ca169b","kind":"contract-release"}],"configuration":{"identities":[{"commitments":[{"scheme":"other","value":"policy:decision-engine.contract-c.supported-claim-verification@1.0.0"}],"kind":"decision-policy","logical_id":"decision-engine.contract-c.supported-claim-verification@1.0.0","resolution":{"commit_sha":"b1bcc33e2b5ef0707b8cbf7dd8e821b2d34d1b55","object_path":"src/contractC2Decision.js","repository":"camerontjs-dot/decision-engine","type":"git-backed"}}]},"execution":{"reason_code":"contract_c_unsupported_semantic_family_not_supported","state":"completed"},"inputs":[{"artifact":{"artifact_id":"contract-c2","commitments":[{"scheme":"sha256-bytes","value":"sha256:300ee4610b13bf3e9e36db5f555bd752acda0357eb97c6917f20941ebfc88967"}],"kind":"contract-c2","logical_id":"contract-c2"},"role":"causal_input"},{"artifact":{"artifact_id":"expected-contract-b","commitments":[{"scheme":"sha256-bytes","value":"sha256:00fee8460ae11f6a745948585a848d632f9a3cb577742f4e5cc316ca4347c434"}],"kind":"expected-contract-b","logical_id":"expected-contract-b"},"role":"authority_input"}],"operation":{"name":"decision-engine-evaluate-c2","version":"b1bcc33e2b5ef0707b8cbf7dd8e821b2d34d1b55"},"outputs":[{"artifact_id":"contract-d","commitments":[{"scheme":"sha256-bytes","value":"sha256:f5fb9f3607e4bda801135233c6aae00829e49cec1d253859045f998305072cfc"}],"kind":"contract-d","logical_id":"contract-d"}],"producer":{"implementation":{"commit_sha":"b1bcc33e2b5ef0707b8cbf7dd8e821b2d34d1b55","kind":"git","repository":"camerontjs-dot/decision-engine"},"system_id":"decision-engine"},"run":{"run_id":"CAL-FULL-CHAIN-RC0-20260917-health-canada-text-representation","work_id":"health-canada-text-representation"},"stage":{"id":"decision_engine","kind":"decision_engine"}}
