{"attestation_id":"attestation:sha256:c9b066d81949bf8700f93371ee1a931d72e2d9a29e640393cfbd566b1c733a82","attestation_schema":"cal-pipeline-apparatus-attestation-v1-explicit-link-rc0","attestation_sha256":"sha256:c9b066d81949bf8700f93371ee1a931d72e2d9a29e640393cfbd566b1c733a82","authorities":[{"id":"camerontjs-dot/apparatus-contracts C2 authority","immutable_id":"b42c827acb0a9fe65353354d709add0e27bab307","kind":"git-commit"},{"id":"camerontjs-dot/apparatus-contracts Contract D 1.0.0","immutable_id":"298a1a0f7b7b6d7712e11200d04faec3e1ca169b","kind":"git-commit"},{"id":"camerontjs-dot/decision-engine","immutable_id":"b1bcc33e2b5ef0707b8cbf7dd8e821b2d34d1b55","kind":"git-commit"},{"id":"contract-d-v1.0.0","immutable_id":"298a1a0f7b7b6d7712e11200d04faec3e1ca169b","kind":"contract-release"}],"configuration":{"identities":[{"commitments":[{"scheme":"other","value":"policy:decision-engine.contract-c.supported-claim-verification@1.0.0"}],"kind":"decision-policy","logical_id":"decision-engine.contract-c.supported-claim-verification@1.0.0","resolution":{"commit_sha":"b1bcc33e2b5ef0707b8cbf7dd8e821b2d34d1b55","object_path":"src/contractC2Decision.js","repository":"camerontjs-dot/decision-engine","type":"git-backed"}}]},"execution":{"reason_code":"contract_c_unsupported_semantic_family_not_supported","state":"completed"},"inputs":[{"artifact":{"artifact_id":"contract-c2","commitments":[{"scheme":"sha256-bytes","value":"sha256:03e89ae58bc942811a7a23832d8956b6fdb60f4e8f6cdebcb3d970bdca3c9e1e"}],"kind":"contract-c2","logical_id":"contract-c2"},"role":"causal_input"},{"artifact":{"artifact_id":"expected-contract-b","commitments":[{"scheme":"sha256-bytes","value":"sha256:0c069155cf04023acd6f987b76b337d63f19bd515817b268f0bf9ce015645313"}],"kind":"expected-contract-b","logical_id":"expected-contract-b"},"role":"authority_input"}],"operation":{"name":"decision-engine-evaluate-c2","version":"b1bcc33e2b5ef0707b8cbf7dd8e821b2d34d1b55"},"outputs":[{"artifact_id":"contract-d","commitments":[{"scheme":"sha256-bytes","value":"sha256:4b8d295adf3d7e73ad5824c38ba8504bfed3b296b25dc6e7966584b2d022a19a"}],"kind":"contract-d","logical_id":"contract-d"}],"producer":{"implementation":{"commit_sha":"b1bcc33e2b5ef0707b8cbf7dd8e821b2d34d1b55","kind":"git","repository":"camerontjs-dot/decision-engine"},"system_id":"decision-engine"},"run":{"run_id":"CAL-FULL-CHAIN-RC0-20260917-not-needed-single","work_id":"not-needed-single"},"stage":{"id":"decision_engine","kind":"decision_engine"}}
